{
  "schema_version": 1,
  "referential": "RGAA 4.1.2",
  "catalog_version": "2026-09-02",
  "claim": "Règles de préqualification par instance ; aucun verdict de conformité automatique.",
  "rules": [
    {
      "rule_id": "RGAA-1-1-IMAGE-ALT-001", "criterion": "1.1", "test": "1.1.1", "component": "image", "severity": "Bloquant", "automation": "STATIC_DOM", "title": "Image sans alternative déclarée",
      "expected": "Chaque image informative possède une alternative ; le rôle et la pertinence restent humains.", "expected_code": "<img src=\"…\" alt=\"Alternative à valider\">", "impact": "L’information portée par l’image peut être absente de la restitution vocale.", "recommendation": "Ajouter une alternative puis faire valider sa pertinence éditoriale.", "verification": "Inspecter l’alternative calculée et comparer son sens au contenu visuel.", "limitations": ["La présence de alt ne prouve pas sa pertinence."]
    },
    {
      "rule_id": "RGAA-1-2-DECORATIVE-SVG-002", "criterion": "1.2", "test": "1.2.4", "component": "image", "severity": "Majeur", "automation": "STATIC_DOM", "title": "Image SVG décorative encore nommée",
      "expected": "Une image SVG décorative masquée avec aria-hidden=true ne possède ni aria-label, ni aria-labelledby, ni title accessible.", "expected_code": "<svg aria-hidden=\"true\" focusable=\"false\">…</svg>", "impact": "Une image décorative peut être restituée inutilement et ajouter du bruit à la navigation.", "recommendation": "Conserver aria-hidden=true et retirer les mécanismes de nommage accessibles de la racine décorative.", "verification": "Contrôler l’absence de l’image dans l’arbre d’accessibilité.", "limitations": ["Le caractère réellement décoratif de l’image reste à confirmer visuellement."]
    },
    {
      "rule_id": "RGAA-2-1-IFRAME-TITLE-001", "criterion": "2.1", "test": "2.1.1", "component": "iframe", "severity": "Majeur", "automation": "STATIC_DOM", "title": "Cadre sans titre",
      "expected": "Chaque iframe possède un attribut title pertinent.", "expected_code": "<iframe title=\"Description du contenu embarqué\" …></iframe>", "impact": "La fonction du cadre n’est pas identifiable avant d’y entrer.", "recommendation": "Ajouter un title puis vérifier sa pertinence.", "verification": "Contrôler le nom calculé du cadre dans l’arbre d’accessibilité.", "limitations": ["La présence du title ne prouve pas sa pertinence."]
    },
    {
      "rule_id": "RGAA-6-2-LINK-NAME-001", "criterion": "6.2", "test": "6.2.1", "component": "link", "severity": "Bloquant", "automation": "ACCESSIBLE_NAME", "title": "Lien sans intitulé accessible",
      "expected": "Chaque lien possède un nom accessible non vide.", "expected_code": "<a href=\"/destination\">Intitulé explicite</a>", "impact": "La destination ou la fonction du lien ne peut pas être comprise.", "recommendation": "Ajouter un intitulé visible ou un nom accessible équivalent.", "verification": "Parcourir la liste des liens avec un lecteur d’écran.", "limitations": ["Un nom non vide ne prouve pas sa pertinence en contexte."]
    },
    {
      "rule_id": "RGAA-7-1-DIALOG-NAME-001", "criterion": "7.1", "test": "7.1.1", "component": "dialog", "severity": "Bloquant", "automation": "STATIC_DOM", "title": "Dialogue dont la référence de nom est absente",
      "expected": "aria-labelledby référence un titre présent ou aria-label fournit un nom pertinent.", "expected_code": "<dialog aria-labelledby=\"dialog-title\"><h2 id=\"dialog-title\">…</h2></dialog>", "impact": "Le contexte et la fonction de la fenêtre peuvent ne pas être annoncés.", "recommendation": "Créer la cible référencée ou corriger le mécanisme de nommage.", "verification": "Ouvrir le dialogue et contrôler son nom avec un lecteur d’écran.", "limitations": ["Le comportement et la pertinence du nom restent à tester."]
    },
    {
      "rule_id": "RGAA-7-1-ARIA-REFERENCE-002", "criterion": "7.1", "test": "7.1.1", "component": "script", "severity": "Majeur", "automation": "STATIC_DOM", "title": "Référence ARIA absente",
      "expected": "Chaque identifiant cité par un attribut de relation ARIA correspond à un élément présent dans le document.", "expected_code": "<div aria-describedby=\"description\"><p id=\"description\">…</p></div>", "impact": "Le nom, la description, l’état ou la relation attendue par une technologie d’assistance peut être incomplet.", "recommendation": "Créer la cible référencée ou retirer la référence obsolète après analyse du composant.", "verification": "Exercer le composant puis contrôler ses nom, description et relations dans l’arbre d’accessibilité.", "limitations": ["Une référence valide ne prouve pas la compatibilité complète du composant avec les technologies d’assistance."]
    },
    {
      "rule_id": "RGAA-7-1-SCRIPT-ARIA-HIDDEN-003", "criterion": "7.1", "test": "7.1.1", "component": "script", "severity": "Bloquant", "automation": "INTERACTIVE", "title": "Composant scripté visible mais masqué aux technologies d’assistance",
      "expected": "Un composant rendu visible par script retire aria-hidden avant d’exposer et de focaliser ses contrôles.", "expected_code": "<div role=\"dialog\"><form role=\"search\">…</form></div>", "impact": "Les contrôles visibles et focalisables peuvent ne plus exposer leur nom, rôle ou valeur aux API d’accessibilité.", "recommendation": "Synchroniser aria-hidden avec l’état visible avant le déplacement du focus.", "verification": "Ouvrir le composant au clavier puis contrôler simultanément le focus, le DOM et l’arbre d’accessibilité.", "limitations": ["La compatibilité complète doit être confirmée avec une technologie d’assistance réelle."]
    },
    {
      "rule_id": "RGAA-8-1-DOCTYPE-001", "criterion": "8.1", "test": "8.1.1", "component": "document", "severity": "Majeur", "automation": "STATIC_DOM", "title": "Type de document absent ou invalide",
      "expected": "Le document déclare un doctype HTML.", "expected_code": "<!doctype html>", "impact": "Le navigateur peut utiliser un mode de compatibilité non attendu.", "recommendation": "Déclarer le doctype HTML en première ligne.", "verification": "Inspecter document.doctype et la réponse HTML.", "limitations": ["Le DOM rendu ne remplace pas la validation complète du code source."]
    },
    {
      "rule_id": "RGAA-8-1-DOCTYPE-VALID-002", "criterion": "8.1", "test": "8.1.2", "component": "document", "severity": "Majeur", "automation": "STATIC_DOM", "title": "Doctype HTML invalide",
      "expected": "Le document utilise un doctype HTML valide.", "expected_code": "<!doctype html>", "impact": "Le navigateur peut appliquer un mode de compatibilité et modifier l’interprétation du document.", "recommendation": "Déclarer <!doctype html> sans identifiant public ou système obsolète.", "verification": "Contrôler le doctype dans le code source généré et le mode de rendu du navigateur.", "limitations": ["Le contrôle porte sur le document rendu capturé."]
    },
    {
      "rule_id": "RGAA-8-1-DOCTYPE-POSITION-003", "criterion": "8.1", "test": "8.1.3", "component": "document", "severity": "Majeur", "automation": "STATIC_DOM", "title": "Doctype placé après l’élément html",
      "expected": "La déclaration de type précède l’élément html dans le document.", "expected_code": "<!doctype html><html lang=\"fr\">…</html>", "impact": "Le mode d’interprétation du document peut devenir imprévisible.", "recommendation": "Placer le doctype avant l’élément html.", "verification": "Inspecter l’ordre des nœuds racine du document généré.", "limitations": ["Les commentaires autorisés autour du doctype ne sont pas considérés comme un échec."]
    },
    {
      "rule_id": "RGAA-8-2-ID-UNIQUE-001", "criterion": "8.2", "test": "8.2.1", "component": "html", "severity": "Majeur", "automation": "STATIC_DOM", "title": "Identifiant HTML dupliqué",
      "expected": "Chaque attribut id est unique dans le document.", "expected_code": "<!-- Un identifiant unique par élément -->", "impact": "Les relations de formulaire, ancres, scripts et références ARIA deviennent ambiguës.", "recommendation": "Rendre l’identifiant unique et mettre à jour ses références.", "verification": "Compter chaque id dans le DOM rendu.", "limitations": ["La règle ne valide pas toute la conformité HTML du critère 8.2."]
    },
    {
      "rule_id": "RGAA-8-2-ANCHOR-TYPE-002", "criterion": "8.2", "test": "8.2.1", "component": "html", "severity": "Majeur", "automation": "STATIC_DOM", "title": "Valeur type invalide sur un lien",
      "expected": "Lorsqu’un élément a possède un attribut type, sa valeur est un type MIME valide.", "expected_code": "<a href=\"/document\" type=\"text/html\">Document</a>", "impact": "Une valeur HTML invalide dégrade la robustesse et peut produire des interprétations imprévisibles.", "recommendation": "Supprimer l’attribut type inutile ou utiliser un type MIME valide correspondant à la ressource.", "verification": "Valider le DOM rendu et contrôler chaque attribut type porté par un élément a.", "limitations": ["La règle vérifie la syntaxe MIME de type sur a et ne remplace pas un validateur HTML complet."]
    },
    {
      "rule_id": "RGAA-8-3-DOCUMENT-LANG-001", "criterion": "8.3", "test": "8.3.1", "component": "document", "severity": "Bloquant", "automation": "STATIC_DOM", "title": "Langue principale absente",
      "expected": "html possède une langue principale valide.", "expected_code": "<html lang=\"fr\">", "impact": "La synthèse vocale peut appliquer une prononciation incorrecte.", "recommendation": "Déclarer la langue principale du document.", "verification": "Contrôler l’attribut lang et sa validité.", "limitations": ["Le code de langue ne prouve pas la langue réelle du contenu."]
    },
    {
      "rule_id": "RGAA-8-5-DOCUMENT-TITLE-001", "criterion": "8.5", "test": "8.5.1", "component": "document", "severity": "Majeur", "automation": "STATIC_DOM", "title": "Titre de page absent",